{
  "$schema": "./component-contract.schema.json",
  "component": "Chat",
  "contractVersion": "0.2.0",
  "status": "proposed",
  "summary": "A provider-agnostic AI chat panel. Keen renders the conversation, streams the assistant reply, and owns keyboard, focus, and screen-reader behavior. The host connects its AI provider through an adapter and keeps the conversation.",
  "design": {
    "source": "design/keen.pen",
    "note": "The .pen file is the visual review artifact, drawn by the design agent. Its variables block is generated from tokens/*.json and design/canvas.json by pnpm tokens:build, so it is never edited by hand. Each layer that draws a part carries keen-part metadata naming its component, part, and element; that metadata, not the layer name, links the design to this contract. Pen 0.3 cannot bind width or height to a variable, so chat.message-max-width and chat.composer-height are applied as numbers and named in the metadata's sizes."
  },
  "boundary": {
    "keen": ["Chat UI and layout", "State machine and streaming behavior", "Keyboard, focus, and screen-reader behavior", "Tokens and override points", "Component docs"],
    "host": ["AI provider and model", "Credentials and network calls", "Conversation persistence", "Conversation lifecycle: when a chat starts, resets, or is discarded", "Rate limits and connectivity: whether a limit applies, its retry time, and whether the user is online", "Product copy passed through labels and slots"]
  },
  "states": [
    { "name": "empty", "description": "No messages yet. The empty slot and optional suggestions fill the log.", "composer": "send", "partialResponse": "none", "announcement": "Nothing is announced.", "evidence": ["design/exports/chat-01-empty-light.png", "design/exports/chat-01-empty-dark.png"] },
    { "name": "loading", "description": "The request is sent and no text has arrived. A pending message shows the thinking label.", "composer": "stop", "partialResponse": "none", "announcement": "The live region says the thinking label once.", "evidence": ["design/exports/chat-02-loading-light.png", "design/exports/chat-02-loading-dark.png"] },
    { "name": "streaming", "description": "Text chunks append to the assistant message, which is marked busy.", "composer": "stop", "partialResponse": "growing", "announcement": "Only newly appended text is announced, flushed at sentence ends.", "evidence": ["design/exports/chat-03-streaming-light.png", "design/exports/chat-03-streaming-dark.png"] },
    { "name": "completed", "description": "The adapter finished. The full response is in the log.", "composer": "send", "partialResponse": "none", "announcement": "Any unannounced remainder is flushed. The full message is not re-read.", "evidence": ["design/exports/chat-04-completed-light.png", "design/exports/chat-04-completed-dark.png"] },
    { "name": "error", "description": "The adapter failed before any text arrived. An error notice with Retry follows the user message.", "composer": "send", "partialResponse": "none", "announcement": "The error notice is a role=alert region, announced once.", "evidence": ["design/exports/chat-05-error-light.png", "design/exports/chat-05-error-dark.png"] },
    { "name": "stopped", "description": "The user stopped generation. The partial response stays and shows the stopped status.", "composer": "send", "partialResponse": "kept", "announcement": "The live region says the stopped label.", "evidence": ["design/exports/chat-06-stopped-light.png", "design/exports/chat-06-stopped-dark.png"] },
    { "name": "error-mid-stream", "description": "The adapter failed after text arrived. The partial response stays and an error notice with Retry follows it.", "composer": "send", "partialResponse": "kept", "announcement": "The error notice is a role=alert region, announced once.", "evidence": ["design/exports/chat-07-error-mid-stream-light.png", "design/exports/chat-07-error-mid-stream-dark.png"] },
    { "name": "rate-limited", "description": "The host reported a rate limit. A notice with a countdown to the retry time, or a fallback detail without one, replaces the input. The log is unchanged.", "composer": "notice", "partialResponse": "unchanged", "announcement": "The notice is a polite role=status region, announced once with the retry time. Countdown ticks are not announced.", "evidence": ["design/exports/chat-08-rate-limited-light.png", "design/exports/chat-08-rate-limited-dark.png"] },
    { "name": "offline", "description": "The host reports no connection. A banner shows below the header and Send is disabled; the input still takes a draft. The log is unchanged.", "composer": "send-disabled", "partialResponse": "unchanged", "announcement": "The banner is a polite role=status region, announced once. The live region says the back-online label on reconnect.", "evidence": ["design/exports/chat-09-offline-light.png", "design/exports/chat-09-offline-dark.png"] }
  ],
  "transitions": [
    { "from": ["empty", "completed", "error", "stopped", "error-mid-stream"], "event": "submit", "to": "loading" },
    { "from": ["loading"], "event": "first chunk", "to": "streaming" },
    { "from": ["streaming"], "event": "adapter finishes", "to": "completed" },
    { "from": ["loading"], "event": "adapter throws", "to": "error" },
    { "from": ["streaming"], "event": "adapter throws", "to": "error-mid-stream" },
    { "from": ["loading", "streaming"], "event": "stop", "to": "stopped" },
    { "from": ["error"], "event": "retry: resend the same request", "to": "loading" },
    { "from": ["error-mid-stream"], "event": "retry: drop the partial, resend the same request", "to": "loading" },
    { "from": ["empty", "completed", "error", "stopped", "error-mid-stream"], "event": "host sets a rateLimit that applies, or a limit applies when this state is entered", "to": "rate-limited" },
    { "from": ["rate-limited"], "event": "retryAt passes or host sets rateLimit to null", "to": "previous" },
    { "from": ["empty", "completed", "error", "stopped", "error-mid-stream"], "event": "host sets online to false, or online is still false when this state is entered", "to": "offline" },
    { "from": ["offline"], "event": "host sets online to true", "to": "previous" }
  ],
  "anatomy": [
    { "part": "root", "element": "section", "description": "The panel. Fills the box the host gives it." },
    { "part": "header", "element": "header", "slot": true, "description": "Shows labels.title, or the header slot.", "elements": [{ "name": "title", "description": "The title text: labels.title." }] },
    { "part": "offline-banner", "element": "div[role=status]", "description": "Icon, title, and detail. Shown below the header while online is false.", "elements": [{ "name": "title", "description": "The offline title." }, { "name": "detail", "description": "The offline detail text." }] },
    { "part": "log", "element": "div > ol", "description": "Scrollable conversation. One li per message, notice, or pending reply." },
    { "part": "message-user", "element": "li", "description": "User text in an end-aligned bubble.", "elements": [{ "name": "bubble", "description": "The bubble that holds the message text." }] },
    { "part": "message-assistant", "element": "li", "description": "Assistant text in a start-aligned bubble, plus a status line when stopped.", "elements": [{ "name": "bubble", "description": "The bubble that holds the reply text." }, { "name": "status", "description": "The stopped or error status line below the bubble." }] },
    { "part": "message-pending", "element": "li", "description": "Thinking indicator shown while loading.", "elements": [{ "name": "bubble", "description": "The bubble that holds the thinking dots and label." }] },
    { "part": "error-notice", "element": "li > div[role=alert]", "description": "Error title, detail, and the Retry button.", "elements": [{ "name": "title", "description": "The error title." }, { "name": "detail", "description": "The error detail text." }, { "name": "retry", "description": "The Retry button." }] },
    { "part": "empty", "element": "div", "slot": true, "description": "Default icon, title, and body, or the empty slot.", "elements": [{ "name": "icon", "description": "The decorative icon tile." }, { "name": "title", "description": "labels.emptyTitle." }, { "name": "body", "description": "labels.emptyBody." }, { "name": "suggestions", "description": "The row of suggestion buttons." }] },
    { "part": "suggestion", "element": "button", "description": "One per suggestions entry, below the empty content. Sends its text." },
    { "part": "composer", "element": "form", "description": "Message input and the Send or Stop action." },
    { "part": "input", "element": "textarea", "description": "Message input with a visually hidden label.", "elements": [{ "name": "field", "description": "The bordered field around the textarea, Send, and Stop." }] },
    { "part": "send", "element": "button[type=submit]", "description": "Icon button. Disabled while the input is empty; aria-disabled while offline." },
    { "part": "stop", "element": "button[type=button]", "description": "Replaces Send while loading or streaming." },
    { "part": "rate-limit-notice", "element": "div[role=status]", "description": "Icon, title, and the countdown or fallback detail. Replaces the input and Send while rate limited; the composer keeps its padding and divider.", "elements": [{ "name": "title", "description": "The rate-limit title." }] },
    { "part": "live-region", "element": "div[aria-live=polite]", "drawn": false, "description": "Visually hidden. Carries loading, streaming, stopped, back-online, and limit-lifted announcements." }
  ],
  "api": {
    "types": [
      "type ChatRole = \"user\" | \"assistant\";",
      "interface ChatMessage { id: string; role: ChatRole; content: string; status?: \"complete\" | \"stopped\" | \"error\"; }",
      "interface ChatRequest { messages: readonly ChatMessage[]; }",